{
  "contract_id": "static-web-release",
  "schema_version": "1.0.0",
  "release_id": "web-0123456789abcdef0123",
  "generated_at": "2026-08-18T12:00:00Z",
  "as_of": "2026-08-17",
  "signal_id": "signal-20260817",
  "signal_sha256": "aaaaaaaaaaaaaaaaaaaaaaaaaaaaaaaaaaaaaaaaaaaaaaaaaaaaaaaaaaaaaaaa",
  "account_state_id": "shadow-main-000001",
  "account_state_sha256": "bbbbbbbbbbbbbbbbbbbbbbbbbbbbbbbbbbbbbbbbbbbbbbbbbbbbbbbbbbbbbbbb",
  "files": [
    {"path": "app.css", "sha256": "cccccccccccccccccccccccccccccccccccccccccccccccccccccccccccccccc", "file_size_bytes": 100},
    {"path": "app.js", "sha256": "dddddddddddddddddddddddddddddddddddddddddddddddddddddddddddddddd", "file_size_bytes": 100},
    {"path": "index.html", "sha256": "eeeeeeeeeeeeeeeeeeeeeeeeeeeeeeeeeeeeeeeeeeeeeeeeeeeeeeeeeeeeeeee", "file_size_bytes": 100},
    {"path": "production-signal.json", "sha256": "aaaaaaaaaaaaaaaaaaaaaaaaaaaaaaaaaaaaaaaaaaaaaaaaaaaaaaaaaaaaaaaa", "file_size_bytes": 100},
    {"path": "simulated-account-state.json", "sha256": "bbbbbbbbbbbbbbbbbbbbbbbbbbbbbbbbbbbbbbbbbbbbbbbbbbbbbbbbbbbbbbbb", "file_size_bytes": 100}
  ]
}
